{
  "metadata": {
    "storage_contract_id": "MOXDOP_DATA_POOL_STORAGE",
    "version": 1,
    "status": "FROZEN_FOR_WAREHOUSE_IMPLEMENTATION",
    "created_at": "2026-08-13",
    "data_contract_registry_id": "MOXDOP_DATA_CONTRACT_REGISTRY",
    "data_contract_registry_version": 1,
    "data_contract_registry_checksum": "428a6eb363765229ef62a5380974bc36e23e819e5a4ade4c00561350add15c2e",
    "data_contract_registry_commit": "b498c8c41b8af8daccf26ab4c3519159f9e9900a",
    "formula_registry_version": 1,
    "collection_engine_reference": "cursor/collection-engine-foundation-ea01@9661351",
    "production_database": "POSTGRESQL",
    "raw_storage": "PRIVATE_OBJECT_STORAGE_VIA_LARAVEL_FILESYSTEM",
    "description": "Physical V1 data-pool storage mapping for collection-ready logical datasets. Collectors emit canonical batches; WarehouseWriter resolves tables.",
    "invariants": [
      "RAW_DATA_DISTINCT_FROM_NORMALIZED",
      "NORMALIZED_DISTINCT_FROM_EVIDENCE",
      "NO_GENERIC_EAV_METRICS_TABLE",
      "COLLECTION_RUN_IS_PROVENANCE_NOT_FACT_IDENTITY",
      "RETRY_IDEMPOTENT_VIA_NATURAL_KEYS",
      "CHECKPOINT_AFTER_DURABLE_COMMIT",
      "REDIS_NOT_WAREHOUSE",
      "BIGQUERY_NOT_REQUIRED_V1",
      "MISSING_NEVER_EQUALS_ZERO",
      "NO_FLOAT_MONEY"
    ]
  },
  "enums": {
    "disposition": [
      "PHYSICAL_TABLE",
      "RAW_ONLY",
      "DERIVED_RUNTIME",
      "DOMAIN_DATA",
      "NO_STORAGE_REQUIRED",
      "DEFERRED",
      "STORAGE_CONTRACT_GAP",
      "UNAVAILABLE"
    ],
    "write_mode": [
      "UPSERT_DAILY_FACT",
      "UPSERT_CURRENT_STATE",
      "APPEND_SNAPSHOT",
      "UPSERT_EDGE",
      "APPEND_OBSERVATION"
    ],
    "partition_strategy": [
      "NONE",
      "RANGE_MONTHLY"
    ]
  },
  "dispositions": [
    {
      "logical_dataset_id": "ga4_property_metadata",
      "disposition": "PHYSICAL_TABLE",
      "table": "ga4_property_metadata"
    },
    {
      "logical_dataset_id": "ga4_property_daily",
      "disposition": "PHYSICAL_TABLE",
      "table": "ga4_property_daily"
    },
    {
      "logical_dataset_id": "ga4_acquisition_channel_daily",
      "disposition": "PHYSICAL_TABLE",
      "table": "ga4_acquisition_channel_daily"
    },
    {
      "logical_dataset_id": "ga4_source_medium_daily",
      "disposition": "PHYSICAL_TABLE",
      "table": "ga4_source_medium_daily"
    },
    {
      "logical_dataset_id": "ga4_campaign_daily",
      "disposition": "PHYSICAL_TABLE",
      "table": "ga4_campaign_daily"
    },
    {
      "logical_dataset_id": "ga4_landing_page_daily",
      "disposition": "PHYSICAL_TABLE",
      "table": "ga4_landing_page_daily"
    },
    {
      "logical_dataset_id": "ga4_event_daily",
      "disposition": "PHYSICAL_TABLE",
      "table": "ga4_event_daily"
    },
    {
      "logical_dataset_id": "ga4_event_channel_daily",
      "disposition": "PHYSICAL_TABLE",
      "table": "ga4_event_channel_daily"
    },
    {
      "logical_dataset_id": "ga4_event_source_medium_daily",
      "disposition": "STORAGE_CONTRACT_GAP",
      "reason": "Prompt 7 DECISION_REQUIRED — no invented grain/storage",
      "blocking": false
    },
    {
      "logical_dataset_id": "ga4_event_campaign_daily",
      "disposition": "PHYSICAL_TABLE",
      "table": "ga4_event_campaign_daily"
    },
    {
      "logical_dataset_id": "ga4_event_landing_daily",
      "disposition": "PHYSICAL_TABLE",
      "table": "ga4_event_landing_daily"
    },
    {
      "logical_dataset_id": "ga4_device_daily",
      "disposition": "PHYSICAL_TABLE",
      "table": "ga4_device_daily"
    },
    {
      "logical_dataset_id": "ga4_business_action_mapping",
      "disposition": "DOMAIN_DATA",
      "reason": "Operator/mapping domain — not provider fact table"
    },
    {
      "logical_dataset_id": "ga4_funnel_definition",
      "disposition": "DEFERRED",
      "reason": "Prompt 7 DEFERRED"
    },
    {
      "logical_dataset_id": "gsc_property_daily",
      "disposition": "PHYSICAL_TABLE",
      "table": "gsc_property_daily"
    },
    {
      "logical_dataset_id": "gsc_query_daily",
      "disposition": "PHYSICAL_TABLE",
      "table": "gsc_query_daily"
    },
    {
      "logical_dataset_id": "gsc_page_daily",
      "disposition": "PHYSICAL_TABLE",
      "table": "gsc_page_daily"
    },
    {
      "logical_dataset_id": "gsc_query_page_daily",
      "disposition": "PHYSICAL_TABLE",
      "table": "gsc_query_page_daily"
    },
    {
      "logical_dataset_id": "gsc_country_daily",
      "disposition": "PHYSICAL_TABLE",
      "table": "gsc_country_daily"
    },
    {
      "logical_dataset_id": "gsc_device_daily",
      "disposition": "PHYSICAL_TABLE",
      "table": "gsc_device_daily"
    },
    {
      "logical_dataset_id": "gsc_search_appearance_daily",
      "disposition": "PHYSICAL_TABLE",
      "table": "gsc_search_appearance_daily"
    },
    {
      "logical_dataset_id": "gsc_url_inspection_snapshot",
      "disposition": "PHYSICAL_TABLE",
      "table": "gsc_url_inspection_snapshot"
    },
    {
      "logical_dataset_id": "gsc_sitemap_snapshot",
      "disposition": "PHYSICAL_TABLE",
      "table": "gsc_sitemap_snapshot"
    },
    {
      "logical_dataset_id": "gsc_brand_term_map",
      "disposition": "DOMAIN_DATA",
      "reason": "Operator/mapping domain — not provider fact table"
    },
    {
      "logical_dataset_id": "gsc_intended_owner_map",
      "disposition": "DOMAIN_DATA",
      "reason": "Operator/mapping domain — not provider fact table"
    },
    {
      "logical_dataset_id": "google_ads_account_snapshot",
      "disposition": "PHYSICAL_TABLE",
      "table": "google_ads_account_snapshot"
    },
    {
      "logical_dataset_id": "google_ads_account_daily",
      "disposition": "PHYSICAL_TABLE",
      "table": "google_ads_account_daily"
    },
    {
      "logical_dataset_id": "google_ads_campaign_snapshot",
      "disposition": "PHYSICAL_TABLE",
      "table": "google_ads_campaign_snapshot"
    },
    {
      "logical_dataset_id": "google_ads_campaign_daily",
      "disposition": "PHYSICAL_TABLE",
      "table": "google_ads_campaign_daily"
    },
    {
      "logical_dataset_id": "google_ads_ad_group_snapshot",
      "disposition": "PHYSICAL_TABLE",
      "table": "google_ads_ad_group_snapshot"
    },
    {
      "logical_dataset_id": "google_ads_ad_snapshot",
      "disposition": "PHYSICAL_TABLE",
      "table": "google_ads_ad_snapshot"
    },
    {
      "logical_dataset_id": "google_ads_keyword_snapshot",
      "disposition": "PHYSICAL_TABLE",
      "table": "google_ads_keyword_snapshot"
    },
    {
      "logical_dataset_id": "google_ads_keyword_daily",
      "disposition": "PHYSICAL_TABLE",
      "table": "google_ads_keyword_daily"
    },
    {
      "logical_dataset_id": "google_ads_search_term_daily",
      "disposition": "PHYSICAL_TABLE",
      "table": "google_ads_search_term_daily"
    },
    {
      "logical_dataset_id": "google_ads_landing_page_daily",
      "disposition": "PHYSICAL_TABLE",
      "table": "google_ads_landing_page_daily"
    },
    {
      "logical_dataset_id": "google_ads_conversion_action_snapshot",
      "disposition": "PHYSICAL_TABLE",
      "table": "google_ads_conversion_action_snapshot"
    },
    {
      "logical_dataset_id": "google_ads_conversion_action_daily",
      "disposition": "PHYSICAL_TABLE",
      "table": "google_ads_conversion_action_daily"
    },
    {
      "logical_dataset_id": "google_ads_campaign_budget_snapshot",
      "disposition": "PHYSICAL_TABLE",
      "table": "google_ads_campaign_budget_snapshot"
    },
    {
      "logical_dataset_id": "google_ads_asset_coverage_snapshot",
      "disposition": "PHYSICAL_TABLE",
      "table": "google_ads_asset_coverage_snapshot"
    },
    {
      "logical_dataset_id": "meta_ad_account_snapshot",
      "disposition": "PHYSICAL_TABLE",
      "table": "meta_ad_account_snapshot"
    },
    {
      "logical_dataset_id": "meta_campaign_snapshot",
      "disposition": "PHYSICAL_TABLE",
      "table": "meta_campaign_snapshot"
    },
    {
      "logical_dataset_id": "meta_adset_snapshot",
      "disposition": "PHYSICAL_TABLE",
      "table": "meta_adset_snapshot"
    },
    {
      "logical_dataset_id": "meta_creative_snapshot",
      "disposition": "PHYSICAL_TABLE",
      "table": "meta_creative_snapshot"
    },
    {
      "logical_dataset_id": "meta_campaign_daily",
      "disposition": "PHYSICAL_TABLE",
      "table": "meta_campaign_daily"
    },
    {
      "logical_dataset_id": "meta_adset_daily",
      "disposition": "PHYSICAL_TABLE",
      "table": "meta_adset_daily"
    },
    {
      "logical_dataset_id": "meta_ad_daily",
      "disposition": "PHYSICAL_TABLE",
      "table": "meta_ad_daily"
    },
    {
      "logical_dataset_id": "meta_typed_action_daily",
      "disposition": "PHYSICAL_TABLE",
      "table": "meta_typed_action_daily"
    },
    {
      "logical_dataset_id": "meta_delivery_breakdown_daily",
      "disposition": "PHYSICAL_TABLE",
      "table": "meta_delivery_breakdown_daily"
    },
    {
      "logical_dataset_id": "meta_result_mapping",
      "disposition": "DOMAIN_DATA",
      "reason": "Operator/mapping domain — not provider fact table"
    },
    {
      "logical_dataset_id": "website_asset",
      "disposition": "NO_STORAGE_REQUIRED",
      "reason": "Covered by existing DigitalAsset/control plane"
    },
    {
      "logical_dataset_id": "website_url",
      "disposition": "PHYSICAL_TABLE",
      "table": "website_url"
    },
    {
      "logical_dataset_id": "website_cms_object",
      "disposition": "DEFERRED",
      "reason": "Prompt 7 DEFERRED"
    },
    {
      "logical_dataset_id": "website_http_snapshot",
      "disposition": "PHYSICAL_TABLE",
      "table": "website_http_snapshot"
    },
    {
      "logical_dataset_id": "website_metadata_snapshot",
      "disposition": "PHYSICAL_TABLE",
      "table": "website_metadata_snapshot"
    },
    {
      "logical_dataset_id": "website_heading_snapshot",
      "disposition": "PHYSICAL_TABLE",